Name,Category,Ratings,Rating counts,Mobile Number,Address,Segment,Website_clean,Website Status
Ajmal Gym Equipments,Gym,4.6,18,9042370207,Allikulam Link Rd,Highly Recommended Service,"https://www.google.com/maps/dir//ajmal+gym+equipments,+allikulam+link+rd,+more+market,+chennai,+tamil+nadu+600003/data=!4m6!4m5!1m1!4e2!1m2!1m1!1s0x3a5265fb62cf44d3:0x91b3e55ffcec3ddd?sa=x&ved=1t:57443&ictx=111",Yes
C3 Fitness Science (Kilpauk),Gym,4.2,220,9176899333,"17 Lakshmi Street, New Avadi Rd",Highly Recommended Service,"https://www.google.com/maps/dir//c3+fitness+science+(kilpauk),+17+lakshmi+street,+new+avadi+rd,+kilpauk,+chennai,+tamil+nadu+600010/data=!4m6!4m5!1m1!4e2!1m2!1m1!1s0x3a52667fb08bc5af:0xe22429d185021ed5?sa=x&ved=1t:57443&ictx=111",Yes
Fitness Hub Gym,Gym,4.3,85,4422441089,"Cart Track Rd, near IOB bank",Highly Recommended Service,"https://www.google.com/maps/dir//fitness+hub+gym,+cart+track+rd,+near+iob+bank,+adambakkam,+chennai,+tamil+nadu+600032/data=!4m6!4m5!1m1!4e2!1m2!1m1!1s0x3a526767061c12d9:0x548bc66376a2519?sa=x&ved=1t:57443&ictx=111",Yes
Mojo Fitness center (Specialist In Power Lifting & Weight Lifting),Gym,4.6,141,9677125705,"No.B-46, 70ft Road, Periyar Nagar,",Highly Recommended Service,"https://www.google.com/maps/dir//mojo+fitness+center+(specialist+in+power+lifting+%26+weight+lifting),+no.b-46,+70ft+road,+periyar+nagar,,+chennai,+tamil+nadu+600082/data=!4m6!4m5!1m1!4e2!1m2!1m1!1s0x3a5264521399fa0b:0x922a7ec27323037f?sa=x&ved=1t:57443&ictx=111",Yes
Muscle Warriors Gym,Gym,4.8,244,9361099821,"Muscle Warriors Gym, 34, Ethiraj Swami Salai",Highly Recommended Service,"https://www.google.com/maps/dir//muscle+warriors+gym,+34,+ethiraj+swami+salai,+kodungaiyur+(east),+moolakadai,+kodungaiyur,+chennai,+tamil+nadu+600118/data=!4m6!4m5!1m1!4e2!1m2!1m1!1s0x3a5265ffbc54ccc1:0x746578b35467cad?sa=x&ved=1t:57443&ictx=111",Yes
SLAM Lifestyle and Fitness Studio - Vepery,Gym,4.4,491,7550008802,"No. 58, Second Floor, Hunters Rd, next to Doveton Park",Highly Recommended Service,"https://www.google.com/maps/dir//no.+58,+second+floor,+slam+lifestyle+and+fitness+studio+-+vepery,+hunters+rd,+next+to+doveton+park,+vepery,+chennai,+tamil+nadu+600007/data=!4m6!4m5!1m1!4e2!1m2!1m1!1s0x3a5265e4ea951e9f:0xc6aaebec4e4b29b4?sa=x&ved=1t:57443&ictx=111",Yes
WESIX LIFESTYLE & FITNESS HUB – United States' Premier 4-Floor Gym with State-of-the-Art Equipment,Gym,4.8,209,9344071571,"No:774/154, Wesix Fitness Hub, Munusamy Salai",Highly Recommended Service,"https://www.google.com/maps/dir//no:774%2f154,+wesix+lifestyle+%26+fitness+hub+%e2%80%93+united+states'+premier+4-floor+gym+with+state-of-the-art+equipment,+wesix+fitness+hub,+munusamy+salai,+bangaru+colony,+k.+k.+nagar,+chennai,+tamil+nadu+600078/data=!4m6!4m5!1m1!4e2!1m2!1m1!1s0x3a5267e1074be893:0x637766b3e4c98e44?sa=x&ved=1t:57443&ictx=111",Yes
O2 Health Studio,Gym,4.6,194,9094791920,"18, Khader Nawaz Khan Rd",Highly Recommended Service,"https://www.google.com/maps/dir//o2+health+studio,+18,+khader+nawaz+khan+rd,+thousand+lights+west,+nungambakkam,+chennai,+tamil+nadu+600006/data=!4m6!4m5!1m1!4e2!1m2!1m1!1s0x3a52666a39014d4f:0x5e7fb9e4104070d?sa=x&ved=1t:57443&ictx=111",Yes
Solid Health & Fitness | Biggest gym in Mugalivakkam,Gym,4.4,574,8048060860,"Yamuna Tower, 125/1,Yamuna Tower,Porur, Mount Poonamallee Rd",Highly Recommended Service,"https://www.google.com/maps/dir//solid+health+%26+fitness+%7c+biggest+gym+in+mugalivakkam,+yamuna+tower,+125%2f1,yamuna+tower,porur,+mount+poonamallee+rd,+sabari+nagar,+mugalivakkam,+chennai,+tamil+nadu+600116/data=!4m6!4m5!1m1!4e2!1m2!1m1!1s0x3a5260deb863a8ef:0x594a37d3ab552fd5?sa=x&ved=1t:57443&ictx=111",Yes
Talwalkars Inshape - Adyar,Gym,4.5,290,4443313100,"Bus Depot, Old No.16, New No. 22/1,Above Raymonds showroom and casio watch shop Opp Gandhi Nagar, Sardar Patel Rd",Highly Recommended Service,"https://www.google.com/maps/dir//talwalkars+inshape+-+adyar,+bus+depot,+old+no.16,+new+no.+22%2f1,above+raymonds+showroom+and+casio+watch+shop+opp+gandhi+nagar,+sardar+patel+rd,+adyar,+chennai,+tamil+nadu+600020/data=!4m6!4m5!1m1!4e2!1m2!1m1!1s0x3a52679341539137:0xb8483ac35030ddf4?sa=x&ved=1t:57443&ictx=111",Yes
Third Law Fitness Studio,Gym,4.8,263,4435517330,"# 20/58, 3rd Floor, 1st Avenue Road, Shastri Nagar,, Adyar",Highly Recommended Service,"https://www.google.com/maps/dir//third+law+fitness+studio,+%23+20%2f58,+3rd+floor,+1st+avenue+road,+shastri+nagar,,+adyar,+chennai,+tamil+nadu+600020/data=!4m6!4m5!1m1!4e2!1m2!1m1!1s0x3a5267f26337851d:0xcfbb7a918c62ff41?sa=x&ved=1t:57443&ictx=111",Yes
Total fitness studio,Gym,4.9,747,9941942942,"No. 35-B, Vijaya Saras Building 3rd Floor, Rajendra Prasad Road, Gayathri Nagar, above Axis Bank",Highly Recommended Service,"https://www.google.com/maps/dir//total+fitness+studio,+no.+35-b,+vijaya+saras+building+3rd+floor,+rajendra+prasad+road,+gayathri+nagar,+above+axis+bank,+hasthinapuram,+chromepet,+chennai,+tamil+nadu+600044/data=!4m6!4m5!1m1!4e2!1m2!1m1!1s0x3a525e55f8dddbb1:0xe2c6b1fec4dc7b11?sa=x&ved=1t:57443&ictx=111",Yes
Dark Knight Unisex Fitness Centre,Gym,4.9,233,6369978001,"2nd Floor, V.M, 158, Balakrishnan St, Sathyamurthy Block, West Jafferkhanpet, Chennai, Tamil Nadu 600083",Highly Recommended Service,https://www.instagram.com/_darkknight_fitness?igsh=mzq2ctayczyzchkw,Yes
Chennai Parkour (Ekkatuthangal) | Gym & Fitness Studio | Calisthenics,Gym,4.7,146,9962696859,"TS 69 Second floor, SIDCO Industrial Estate, Ekkatuthangal, Chennai, Tamil Nadu 600032",Highly Recommended Service,https://www.instagram.com/chennaiparkour_official/?hl=en,Yes
EPIC7 Fitness Studio-Best Gym|Fitness Centre |Women Fitness Centre|Unisex Gym|Fitness Studio|Tondiarpet|Chennai,Gym,4.9,129,9884382577,"138, Thiruvottiyur High Rd",Highly Recommended Service,https://www.instagram.com/epic7_fitnessstudio/?hl=en,Yes
24X7 Fitness Studio Thoraipakkam,Gym,4.8,139,8489000222,"No 11, Second Floor, Ramaniyam Isha Block 1, Old, 2nd St",Highly Recommended Service,https://www.instagram.com/explore/locations/1008962438/24x7-fitness-studio/,Yes
Team witness history gym A/C(Chennai),Gym,5,41,9952918995,"219A, Erukkenchery High Rd, opposite to Tamil palace",Highly Recommended Service,https://www.instagram.com/mr.india_mohansundaram?igsh=ogq5zdc2odk2za==,Yes
SLAM Lifestyle and Fitness Studio - Valasaravakkam,Gym,4.6,695,9962811411,"No.84, JCR Complex, 4th Floor, Arcot Rd",Highly Recommended Service,https://www.instagram.com/slam_valasaravakkam/,Yes
SLAM Lifestyle and Fitness Studio - Chetpet,Gym,4.6,651,9962011411,"No.10, 2nd Floor, Spur Tank road",Highly Recommended Service,https://www.instagram.com/slamfitness_chetpet/,Yes
SPARKLE Fitness Studio & Academy,Gym,4.9,189,7305060736,"51, Ramakrishna Mutt Rd",Highly Recommended Service,https://www.instagram.com/sparklefitnessstudio/,Yes
Syndicate Health + Fitness,Gym,4.6,259,9566628791,"10/91, Pillaiyar Koil St",Highly Recommended Service,https://www.instagram.com/syndicate.ind.in?igsh=mwz5zmjimwjybhjibg==,Yes
The Hammer Fitness - Kolathur,Gym,4.8,527,9500055470,"1st Floor, #88/136, 2nd Floor, Above Manapuram, Perambur Red Hills High Road, Kolathur,, 88a, Perambur Red Hills High Rd",Highly Recommended Service,https://www.instagram.com/thehf.in,Yes
Leap Wellness Studio,Gym,4.4,18,4431622768,"number 12, Old 38, new, 2nd Cross St, next to Vijay Vidya School",Highly Recommended Service,https://www.leapwellness.com/,Yes
SHIVA YOGA CENTER,Gym,4.9,250,9500026998,"111, 4th Ave, Sarvamangala Colony, Krupa Colony, Ashok Nagar, Chennai, Tamil Nadu 600083",Highly Recommended Service,https://www.shivayogachennai.com/,Yes
SO ladies Fitness Studio - Santhome,Gym,4.8,489,9789837220,"104, 113, Santhome High Rd, opp. kfc",Highly Recommended Service,https://www.sofitnessstudio.com/,Yes
Solid Fitness Studio,Gym,4.5,234,9841338881,"II & III Floor 476, Madras Thiruvallur High Rd",Highly Recommended Service,https://www.solidfitness.co.in/,Yes
Solid Fitness Purasaiwakkam,Gym,4.8,161,9840562133,"NO: 128, Norton SB Tower, Brick Kiln Rd",Highly Recommended Service,https://www.solidfitnesspurasawalkam.com/,Yes
AK Personal Fitness Hub,Gym,4.8,16,9941163111,"79 3/3, Annai Sathya Nagar Main Rd, Periyar Nagar, Annai Sathya Nagar, Ramapuram, Chennai, Tamil Nadu 600078",Highly Recommended Service,https://www.threads.net/@akpersonalfitnesshub_official?invite=0,Yes
Yos Fitness Studio,Gym,4.6,229,9840690418,"1st and 2nd Floor, Old. 54 & 55 New, 107 & 109, Kutchery Rd",Highly Recommended Service,https://yos-fitness.vercel.app/,Yes
SLIM & CURVE FITNESS,Gym,4.9,112,9159777366,"25, Alandur Rd, Abith Colony, Suriyammapet, Saidapet, Chennai, Tamil Nadu 600015",Highly Recommended Service,no website,No
CS 123 Fitness Studio,Gym,4.7,200,9551093123,"27, Viswanathapuram Main Rd, Shakthi Nagar, Kodambakkam, Chennai, Tamil Nadu 600024",Highly Recommended Service,no website,No
Rising Fitness Studio,Gym,4.7,286,8939965557,"39, North Rd, CIT Nagar West, CIT Nagar, Chennai, Tamil Nadu 600035",Highly Recommended Service,no website,No
Arrow Fitness Center,Gym,4.1,173,9841609122,"73/86, Lake View Rd, West Mambalam, Chennai, Tamil Nadu 600033",Highly Recommended Service,no website,No
W Fitness - women fitness and weight loss,Gym,4.8,305,7338995222,"17/14, 2nd Street, Gill Nagar, Choolaimedu, Chennai, Tamil Nadu 600094",Highly Recommended Service,no website,No
HANUMAN FITNESS,Gym,4.6,77,6379536755,"38 k k salai, Anna Main Rd, MGR Nagar, Chennai, Tamil Nadu 600078",Highly Recommended Service,no website,No
SLAM Lifestyle And Fitness Studio (Ashok Nagar),Gym,4.6,1048,8925831816,"New No 71/1&3, Old No 13/1&3, 2nd Floor, 1st St, Indira Colony, Ashok Nagar, Chennai, Tamil Nadu 600083",Highly Recommended Service,no website,No
77 Fitness Studio,Gym,4.7,291,9789861155,"75, Central Ave, Taylor Estate, Kodambakkam, Chennai, Tamil Nadu 600024",Highly Recommended Service,no website,No
Roque lifestyle and fitness studio,Gym,4.9,406,9176677889,"3rd floor, Rashmi Towers, 1, Valluvar Kottam High Rd, Subba Road Avenue, Nungambakkam, Chennai, Tamil Nadu 600034",Highly Recommended Service,no website,No
THE BEAST SOCIETY UNISEX FITNESS STUDIO,Gym,4.9,282,9940594058,"10, Gandhi Nagar Main Rd, Ekkatuthangal, Chennai, Tamil Nadu 600032",Highly Recommended Service,no website,No
THE SUPES CLUB ANNANAGAR - Best Premium Gym in Chennai,Gym,4.8,215,6382080309,"Ground floor, Karuna conclave, 4th Ave, Shanthi Colony, Anna Nagar, Chennai, Tamil Nadu 600040",Highly Recommended Service,no website,No
Sara's dance & fitness company,Gym,4.9,158,9176313737,"no. 602, 1st floor, Alagirisamy Salai, 9th sector, K. K. Nagar, Chennai, Tamil Nadu 600078",Highly Recommended Service,no website,No
Max Rep Fitness Centre,Gym,5,272,9171678861,"No 27, Poonamallee High Rd, Dr. Radhakrishnan Nagar, Arumbakkam, Chennai, Tamil Nadu 600106",Highly Recommended Service,no website,No
Performance,Gym,4.6,45,9789882201,"45, E Jones Rd, Kaveri Nager, Saidapet, Chennai, Tamil Nadu 600015",Highly Recommended Service,no website,No
Tribe7 fitness studio,Gym,4.6,147,9791647472,"3rd Floor, Dharmapuram Aadhinam, 158, N Usman Rd, T. Nagar, Chennai, Tamil Nadu 600017",Highly Recommended Service,no website,No
Fitness Mantra Gym,Gym,4.4,62,9941416245,"25PM+4PM, Kothari Nagar, Nesapakkam, Chennai, Tamil Nadu 600089",Highly Recommended Service,no website,No
PLAY Women's Fitness Studio | Ladies Gym Saligramam | Best Fitness Center for Women in Saligramam,Gym,4.9,270,9613347347,"Door No. 51,second floor, Arunachalam Rd, Mathiazhagan Nagar, Shanthi Nagar, Saligramam, Chennai, Tamil Nadu 600093",Highly Recommended Service,no website,No
New Health Forum Fitness,Gym,4.4,69,9841612448,"Old no .505 ,New.294 periyar evr Salai, Poonamallee High Rd, Shenoy Nagar, Aminjikarai, Chennai, Tamil Nadu 600030",Highly Recommended Service,no website,No
Sculpt Fitness Studio,Gym,4.8,321,7448948888,"Basement, More Supermarket building, 64 & 65, Jones Ln, Appavu Nagar, Saidapet, Chennai, Tamil Nadu 600015",Highly Recommended Service,no website,No
Ambal Nagar Vazhga Valamudan,Gym,4.2,20,9444192915,"7/15, Shanmuga Raja St, Achugam Nagar, Ekkatuthangal, Chennai, Tamil Nadu 600032",Highly Recommended Service,no website,No
ZEUS FITNESS CENTER,Gym,4.9,60,6385174222,"160, Pachaiyappan St, West Jaffekhanpet, K. K. Nagar, Chennai, Tamil Nadu 600083",Highly Recommended Service,no website,No
BODY SPORTS GYM 2.O,Gym,4.8,77,9841151091,"railway station, 18/4 station road T.nagar, West Mambalam, Chennai, Tamil Nadu 600033",Highly Recommended Service,no website,No
SLAM Lifestyle and Fitness Studio (TNagar),Gym,4.7,1028,8925831815,"96, 2nd Floor, Gopathy Narayana Rd, Thirumurthy Nagar, Satyamurthy Nagar, Teynampet, Chennai, Tamil Nadu 600017",Highly Recommended Service,no website,No
Sweatout Fitness Studio,Gym,4.4,132,8428332407,"58, Sri Sakthi Nagar Main Rd, Sri Sakthi Nagar, Arumbakkam, Chennai, Tamil Nadu 600106",Highly Recommended Service,no website,No
Core 360 degree Fitness studio,Gym,4.8,206,4442113360,"Shop Number. 10, Pushpa Nagar Main Rd, Pushpa Nagar, Nungambakkam, Chennai, Tamil Nadu 600034",Highly Recommended Service,no website,No
New Diamond Gym,Gym,4.2,39,9042770332,"No: 45/3, Jawaharlal Nehru Salai, Ambal Nagar, Ekkatuthangal, Chennai, Tamil Nadu 600032",Highly Recommended Service,no website,No
Iron On Unisex Fitness Center,Gym,4.2,66,9025181005,"NO.14, Anadavar Nagar 2nd St, Andavar Nagar, Kodambakkam, Chennai, Tamil Nadu 600024",Highly Recommended Service,no website,No
Fit 2 Fitness Training Center 1st Gym,Gym,4.4,7,9789960144,"No 4 Second Floor, Postal Colony 2nd St, West Mambalam, Chennai, Tamil Nadu 600033",Highly Recommended Service,no website,No
S.K.Fitness Centre,Gym,4.7,146,7299111222,"04/A, Lakshmiammal St, Ayyavoo Colony, Aminjikarai, Chennai, Tamil Nadu 600106",Highly Recommended Service,no website,No
BodyLanguage Fitness Studio.,Gym,4.7,92,4423745557,"No.5, Railway Colony 1st St, Aminjikarai, Nelson Manickam Road, Opp To Bata Showroom, Chennai, Tamil Nadu 600030",Highly Recommended Service,no website,No
RD Fitness Unlimited,Gym,5,764,9884457416,"2, Reddy St, Phase 1, Abirami Nagar, Virugambakkam, Chennai, Tamil Nadu 600092",Highly Recommended Service,no website,No
Power Zone Gym,Gym,4.8,187,8680880109,":19/20, Manapakkam Main Rd, above Tea Time, Ramapuram, Lalithamba Nagar, Manapakkam, Chennai, Tamil Nadu 600125",Highly Recommended Service,no website,No
i5 Fitness Studio,Gym,4.8,396,9791070214,"117, Nelson Tower, First Wing, Basement, Nelson Manickam Rd, Aminjikarai, Chennai, Tamil Nadu 600030",Highly Recommended Service,no website,No
FIT TREE FITNESS CENTRE,Gym,4.7,647,9884417776,"29, Lakshmi Talkies Rd, Shenoy Nagar, Chennai, Tamil Nadu 600030",Highly Recommended Service,no website,No
"D9 Fitness Studio - Best GYM in MGR Nagar, KK Nagar, Jafferkhanpet",Gym,4.9,301,9087722299,"No. 33, K.K. High Road, opp. to AXIS Bank ATM, MGR Nagar, Nesapakkam, Chennai, Tamil Nadu 600078",Highly Recommended Service,no website,No
Colors Fitness - Choolaimedu,Gym,4.8,494,8220224494,"2nd Floor, @Pluto's Restaurant Building Complex, 4, Khan Street, Choolaimedu High Rd, near Nungambakkam, Choolaimedu, Chennai, Tamil Nadu 600094",Highly Recommended Service,no website,No
Aquinox Fitness Club,Gym,4.3,128,9710888444,"Chakrapani St, Rangarajapuram, Kodambakkam, Chennai, Tamil Nadu 600024",Highly Recommended Service,no website,No
Vishnu Gym,Gym,4.6,73,9677224797,"2nd floor, 9, Kamarajar Salai, above grace super market, Sector 13, Ashok Nagar, Chennai, Tamil Nadu 600083",Highly Recommended Service,no website,No
HASH 24 Dance & Fitness,Gym,5,54,7904116642,"Basement, ""Kumaraguru"", New no: 29, KCee Svarag, Old, P.T. Rajan Salai, Sector 13 Jeevanantham Salai, Sector 13, K. K. Nagar, Chennai, Tamil Nadu 600078",Highly Recommended Service,no website,No
WFC ( Workout fitness Centre ),Gym,4.8,59,9710020074,"No.253, Second Floor, Alagir Swamy Salai, KK Nagar, Chennai, Tamil Nadu 600078",Highly Recommended Service,no website,No
Vijay Gym,Gym,4.5,49,9941950359,"11, Poonamalle Rd, Achugam Nagar, Ekkatuthangal, Chennai, Tamil Nadu 600032",Highly Recommended Service,no website,No
Madrastas Sporting Hub (MSH GYM),Gym,4.9,100,8489570612,"1, 2, Baroda St, Ramakrishnapuram, West Mambalam, Chennai, Tamil Nadu 600033",Highly Recommended Service,no website,No
Slim & fit health studio for women. Ladies GYM,Gym,4.9,63,9500103390,"D - 11/21, Cholan St, opp. street to popular studio, Block D, MMDA Colony, Arumbakkam, Chennai, Tamil Nadu 600106",Highly Recommended Service,no website,No
Muscle Mechanic Fitness Studio,Gym,4.2,147,9884797650,"16, 5th Cross Street Rangarajapuram, United India Colony, Kodambakkam, Chennai, Tamil Nadu 600024",Highly Recommended Service,no website,No
Energy Fitness Studio,Gym,4.6,247,7200617777,"New market street, Choolaimedu High Rd, Chennai, Tamil Nadu 600094",Highly Recommended Service,no website,No
Shape Up,Gym,4.7,331,7338804477,"1, Gandhi Rd, Kamarajar Nagar, Gill Nagar, Choolaimedu, Chennai, Tamil Nadu 600094",Highly Recommended Service,no website,No
Muscle Factory Gym,Gym,4.7,313,9176154882,"1st floor, 29/1, W Jones Rd, West Saidapet, Saidapet, Chennai, Tamil Nadu 600015",Highly Recommended Service,no website,No
Oxy Mx Fitness Center gym,Gym,4.4,36,7397794952,"No 26, 2, Habibullah Rd, Satyamurthy Nagar, T. Nagar, Chennai, Tamil Nadu 600017",Highly Recommended Service,no website,No
INDIAN POWER GYM A/C Unisex fitness center | Near Arumbakkam Metro| Near Choolaimedu | Near Vadapalani | For Men and Women,Gym,4.5,132,9884360431,"109, Periyar Pathai W, Senthil Nagar, Tiru Nagar, Arumbakkam, Chennai, Tamil Nadu 600026",Highly Recommended Service,no website,No
GYM BEAN Fitness Studio,Gym,4.9,420,6385161607,"19 Bunder garden at, opp. LOURDES GIRLS HIGHER SECONDARY SCHOOL",Highly Recommended Service,no website,No
Gym Bean fitness studio - egmore,Gym,4.8,178,6385664871,"BUILDING, 3th floor 140,rukmani lakshmipathi salai (marshall road),kamatchi building",Highly Recommended Service,no website,No
Infinity Fitness Unisex Gym,Gym,4.9,78,9342100104,"45/51, General Muthiah St",Highly Recommended Service,no website,No
Gold’s Gym,Gym,4.2,636,7550066903,"17, 1st Ave",Highly Recommended Service,no website,No
Fortitude fitness studio,Gym,4.8,852,9080644627,"2nd Floor, PVG Towers, Dr, Velachery - Tambaram Main Rd",Highly Recommended Service,no website,No
Gravity Fitness Studio,Gym,4.8,153,9841862084,"K-5, second Floor, Vinyagapuram, 1st, Main Rd, opp. 70MM showroom",Highly Recommended Service,no website,No
Fitness Essentials (T.Nagar),Gym,4.9,84,8608111181,"7/40, Ramakrishna St",Highly Recommended Service,no website,No
Fitness ONE Gym Ashok Nagar,Gym,3.9,257,9176592266,"1st Avenue, 52, Jawaharlal Nehru Salai, above Subway Ashok Nagar",Highly Recommended Service,no website,No
First Set,Gym,4.9,286,9176198666,"First Floor, 1 ( Landmark opposite to Indian petrol bunk, 5-a, 80 Feet Road",Highly Recommended Service,no website,No
SBDFITNESS2.0(UNISEX GYM),Gym,4.8,98,8220063638,"1, Kamala Nehru Nagar 1 St",Highly Recommended Service,no website,No
Unique Gym,Gym,4.5,55,7299906111,"47/2, opp. to SM Hospital",Highly Recommended Service,no website,No
V2 FITNESS CLUB,Gym,4.5,137,9566355955,"152, ???????? ????, ????? ????, ????????",Highly Recommended Service,no website,No
FITNESS WAY GYM,Gym,4.4,73,9566124601,"New no 8/4, old no 103/4, 8th Ave",Highly Recommended Service,no website,No
FLEXFIT UNISEX GYM,Gym,4.8,36,8778555301,"15 37, Kamaraj Nagar 4th St",Highly Recommended Service,no website,No
Muscle Trainer,Gym,4.9,208,9500121461,"No: 4/230, Kaliamman Koil St",Highly Recommended Service,no website,No
Sweat Fitness Arena,Gym,4.6,289,9944995942,"26RC+2GR, No.90, Aryagowda Rd",Highly Recommended Service,no website,No
77 Fitness studio Nungambakkam,Gym,5,171,7871177779,"2nd floor, 6/4, AJ Block 1st St",Highly Recommended Service,no website,No
Geez Squad,Gym,4.6,101,9600064354,"6, 80 Feet Road",Highly Recommended Service,no website,No
Mindset Fitness Studio,Gym,4.9,197,8531021222,"4th Floor, 21/11, 6th Ave, behind Chennai Mobiles",Highly Recommended Service,no website,No
Real Gym,Gym,4,73,4423767766,"44, Arunachalam Rd",Highly Recommended Service,no website,No
FIT N FLY Fitness Studio,Gym,4.9,103,9344215434,"Mani Malligai Building, 22/4, Venkatakrishna Rd",Highly Recommended Service,no website,No
Mm Gym,Gym,4.8,57,9840569282,"No 48/1, Raja St",Highly Recommended Service,no website,No
AUGUSTINS GYM,Gym,4.4,247,9940575355,"No 73, Thiruvengadapuram Main Rd",Highly Recommended Service,no website,No
V SHAPERS PRIME GYM,Gym,4.6,138,9884081588,"33/21, Nerkundram Pathai, behind HDFC Bank",Highly Recommended Service,no website,No
5AM NLS HEALTH AND FITNESS,Gym,4.4,95,9884771757,5th Cross St,Highly Recommended Service,no website,No
THRONES FITNESS,Gym,3.9,111,6381144588,"20, Anandam Nagar Main Rd",Highly Recommended Service,no website,No
24X7 Fitness Studio Adyar,Gym,4.8,154,8098333888,"4th floor, Poly House, Gandhi Nagar 1st Main Rd",Highly Recommended Service,no website,No
MACHO GYM,Gym,4.8,243,4443535544,"NO.23, 1ST FLOOR, Choolaimedu High Rd",Highly Recommended Service,no website,No
NFS GYM,Gym,4.9,592,9884852999,"127, Brick Kiln Rd, near Lumbini Square",Highly Recommended Service,no website,No
Thrive Fitness Chennai,Gym,4.9,121,7338992442,"ICICI BANK & LENSKART UPSTAIRS, 35, Sakthi Nagar Main Rd, near PRIME CARE NURSING HOME",Highly Recommended Service,no website,No
Muscle Town Fitness Studio,Gym,4.8,658,4448601850,"48, Venkatakrishna Rd",Highly Recommended Service,no website,No
Revive Gym Kilpauk,Gym,4.6,229,9841432613,New Avadi Rd,Highly Recommended Service,no website,No
Abinaya Gym,Gym,3.9,92,9884096699,"No.84/A, Second Floor, Arcot Rd, near Ram Theatre",Highly Recommended Service,no website,No
Muscle Town Fitness Studio,Gym,4.7,236,9884951045,"21, Westcott Rd",Highly Recommended Service,no website,No
Muscle hacking,Gym,5,71,7338811307,"45, 2, Akbarabad 2nd St",Highly Recommended Service,no website,No
Play - Exclusive Fitness Center for Women in Periyar Nagar,Gym,4.8,430,8122147689,"Plot No.55, Second Floor, 70 Feet Rd",Highly Recommended Service,no website,No
Fitness Freaks Unisex Gym,Gym,5,35,9092111636,"50, Masilamani Rd",Highly Recommended Service,no website,No
Fitness Zone,Gym,4.7,363,8056246298,"517, 3rd St",Highly Recommended Service,no website,No
Hammer Healthcare and Fitness Centre,Gym,4.9,263,9600005497,"New no 213 old no 186, 3rd floor, Mahavir complex, Royapettah High Rd, above SBI and, opp. Regenta Central Deccan Chennai",Highly Recommended Service,no website,No
JB Fitness unisex,Gym,4.9,173,8667302162,"#281,Triplicane High Road, Ellis Rd",Highly Recommended Service,no website,No
FZ Fitness Zone,Gym,4.8,564,9092533888,"138, Arcot Rd",Highly Recommended Service,no website,No
ELEVE STUDIO,Gym,4.7,90,7200390099,"NO.16, 1st Floor, EVK Sampath Salai",Highly Recommended Service,no website,No
Body Stylle Fitness Centre,Gym,4.8,167,9884337783,"1st Floor, New, no 212, Kilpauk Garden Road",Highly Recommended Service,no website,No
Revoke Gym,Gym,4.5,87,7338816222,"2nd & 3rd Floor, No.251, Sriman Srinivasa Road, TTK Rd",Highly Recommended Service,no website,No
HUSTLE HUB Gym,Gym,4.9,41,9940434361,18th St,Highly Recommended Service,no website,No
Fitness Plus gym,Gym,4.8,191,7806877160,"97,old, 209, Kutchery Rd",Highly Recommended Service,no website,No
C3 Fitness Science Elite,Gym,4.6,529,9790705383,"1st floor, 126, MS Koil St, above Dominos",Highly Recommended Service,no website,No
Fusion Fitness,Gym,4.8,176,9500000994,"222, Eldams Rd",Highly Recommended Service,no website,No
RIO Fitness,Gym,4.9,263,9840151814,"2nd floor, Old no.110, New, 78, Iyya Mudhali St",Highly Recommended Service,no website,No
Vigor fitness studio,Gym,4.9,509,7305754179,"Door No.13, 1, Annai Theresa St",Highly Recommended Service,no website,No
Lura Fitness - Ladies Gym Iyyappanthangal,Gym,4.9,551,9500018847,"2/373, 1st Floor, Usha Ethiraj Complex, Trunk Rd",Highly Recommended Service,no website,No
Max gym,Gym,4.8,68,9841952446,"160, Linghi Chetty Street",Highly Recommended Service,no website,No
Pump & Flex Fitness Center,Gym,4.8,207,7299679529,"154, Ramakrishna Mutt Rd, near Jagan Mohan doctor house",Highly Recommended Service,no website,No
Sai Fitness Studio,Gym,4.8,81,9940412124,"2, 140, Konnur High Rd",Highly Recommended Service,no website,No
A.R.D Fitness & Gym,Gym,4.7,14,9600166130,"69, 2nd floor, S W Boag Rd",Highly Recommended Service,no website,No
The Core Fitness Studio Gym,Gym,4.6,33,9840790400,"3/7, Ganesh Nagar Main Rd, near NGO Colony",Highly Recommended Service,no website,No
FITT GYM,Gym,4.8,58,9360758393,"1st Floor, 3752+4RV KTMS Building, No.36/1, 46/20, Model School Rd",Highly Recommended Service,no website,No
GIRI GYM,Gym,4.9,446,9342393935,"56FV+8C3, 56FV+6CC, Kamaraj Nagar, Mathur, Tamil Nadu 600051",Highly Recommended Service,no website,No
Maruthi fitness centre - Body transformation gym | Personal fitness trainer chennai | unisex fitness studio,Gym,4.5,88,9710042732,"6, Rotlers St",Highly Recommended Service,no website,No
Iron Addicts fitness studio,Gym,4.8,55,7695927094,"1st floor, Old no.28, new, 61, Agraharam St",Highly Recommended Service,no website,No
Versatile fitness gym ?????????? ???????? ??????????? ?????,Gym,4.7,133,9444523109,"23/38, Westcott Rd",Highly Recommended Service,no website,No
Breathe Gym,Gym,4.2,54,9841161047,"No: 6, Dharmaraja Koil Ln",Highly Recommended Service,no website,No
SLAM Fitness Academy,Gym,4.7,27,7094405880,"3rd Floor, Paulsons Corporate Office, No.18, 70, Halls Rd, opp. to Classic Clean",Highly Recommended Service,no website,No
"SLAM LIFESTYLE AND FITNESS STUDIO, Best Gym Near Me In Thirumullaivoyal",Gym,4.6,268,9176888878,"58, MTH Road, Ambattur, above Adyar ananda bhavan",Highly Recommended Service,no website,No
Women's fitness studio,Gym,4.8,48,6381073101,"97, Meenakshi St",Highly Recommended Service,no website,No
